{
  "$id": "battery_transition_artifact_evidence_result_schema_v1.json",
  "$schema": "https://json-schema.org/draft/2020-12/schema",
  "additionalProperties": true,
  "properties": {
    "archive_read": {"const": false},
    "artifact_kind": {"enum": ["battery_snl_lfp_transition_artifact_evidence_gate_result", "battery_snl_lfp_transition_artifact_evidence_gate_compact_summary"]},
    "bounded_source_id": {"const": "snl_lfp_commercial_18650_study"},
    "case_study_id": {"const": "battery_archive_snl_lfp"},
    "cohort_merge_performed": {"const": false},
    "contract_checksum": {"pattern": "^[0-9a-f]{64}$", "type": "string"},
    "contract_id": {"const": "battery_snl_lfp_transition_artifact_evidence_contract_v1"},
    "credentials_read": {"const": false},
    "csv_payload_read": {"const": false},
    "cycle_command_binding_inferred": {"const": false},
    "deterministic_result_checksum": {"pattern": "^[0-9a-f]{64}$", "type": "string"},
    "instrument_channel_binding_inferred": {"const": false},
    "metrics_recomputed": {"const": false},
    "model_evaluated": {"const": false},
    "model_trained": {"const": false},
    "network_called": {"const": false},
    "official_snapshot_inferred": {"const": false},
    "package_id": {"const": "battery_snl_lfp_transition_artifact_evidence_gate_v1"},
    "physical_cell_binding_inferred": {"const": false},
    "preservation_checks": {"type": "object"},
    "recommendations": {"items": {"type": "string"}, "type": "array"},
    "row4_transition_audits": {"maxItems": 3, "minItems": 3, "type": "array"},
    "row_classification_promoted": {"const": false},
    "schema_version": {"const": "2.6.10"},
    "scientific_closeout": {"type": "object"},
    "source_evidence_audit": {"type": "object"},
    "source_mutation_performed": {"const": false},
    "source_references": {"type": "object"},
    "step_identity_inferred": {"const": false},
    "threshold_inference_performed": {"const": false},
    "time_series_entry_read": {"const": false},
    "transition_artifact_decision": {"type": "object"},
    "transition_summary": {"type": "object"}
  },
  "required": ["schema_version", "artifact_kind", "package_id", "case_study_id", "bounded_source_id", "contract_id", "contract_checksum", "source_evidence_audit", "row4_transition_audits", "transition_summary", "transition_artifact_decision", "preservation_checks", "scientific_closeout", "recommendations", "source_references", "deterministic_result_checksum", "network_called", "credentials_read", "archive_read", "csv_payload_read", "time_series_entry_read", "threshold_inference_performed", "row_classification_promoted", "cycle_command_binding_inferred", "step_identity_inferred", "instrument_channel_binding_inferred", "physical_cell_binding_inferred", "official_snapshot_inferred", "cohort_merge_performed", "model_trained", "model_evaluated", "metrics_recomputed", "source_mutation_performed"],
  "schema_version": "1",
  "status": "active",
  "title": "Battery SNL LFP Transition Artifact Evidence Result",
  "type": "object"
}
